{
  "correlation_id": "4ff4e048-b5b6-4785-be99-1723ecd5df5d",
  "id": "4846e57e-39fc-420c-b80e-8f3c3e6c54c3",
  "idempotency_key": "77440d774aefb94bc56c9a8ce62e1f868546687a0acc1105d7f2359f3e08366c",
  "in_reply_to": "4ff4e048-b5b6-4785-be99-1723ecd5df5d",
  "message_type": "result",
  "payload": {
    "output": {
      "duration_ms": 10820,
      "exit_code": 0,
      "ok": true,
      "stderr_tail": "t and access the new version of auto mode, ask your gateway to implement: https://code.claude.com/docs/en/auto-mode-classifier-billing\n<Objs Version=\"1.1.0.1\" xmlns=\"http://schemas.microsoft.com/powershell/2004/04\"><Obj S=\"progress\" RefId=\"0\"><TN RefId=\"0\"><T>System.Management.Automation.PSCustomObject</T><T>System.Object</T></TN><MS><I64 N=\"SourceId\">1</I64><PR N=\"Record\"><AV>����׼���״�ʹ��ģ�顣</AV><AI>0</AI><Nil /><PI>-1</PI><PC>-1</PC><T>Completed</T><SR>-1</SR><SD> </SD></PR></MS></Obj></Objs>",
      "stdout_tail": "✅ **VERIFY_V2_ALIVE 完成**\n\n- 路径: `D:\\AIOS\\_agent-hub\\reports\\verify_v2alive\\out.txt`\n- 内容: `HELLO_ALIVE_231843`\n",
      "transport": "claude_p_subprocess"
    }
  },
  "recipient": "codex",
  "retry_count": 0,
  "schema_version": "1.0",
  "sender": "claudecode",
  "timestamp": "2026-10-08T15:18:57Z",
  "ttl_ms": 300000
}