{
  "correlation_id": "cf66cc3e-859a-4789-bb63-30342690b504",
  "id": "7e68d987-ead5-4cb1-85a5-dfc239bff518",
  "idempotency_key": "2cb30140118f297e80f0a45fb197fbb4fa79acaf27e2378c355239c81af29d87",
  "in_reply_to": "cf66cc3e-859a-4789-bb63-30342690b504",
  "message_type": "ack",
  "payload": {
    "ack_of": "cf66cc3e-859a-4789-bb63-30342690b504",
    "note": "v2_consumer_received"
  },
  "recipient": "codex",
  "retry_count": 0,
  "schema_version": "1.0",
  "sender": "claudecode",
  "timestamp": "2026-10-09T01:11:03Z",
  "ttl_ms": 600000
}