{
  "correlation_id": "cf66cc3e-859a-4789-bb63-30342690b504",
  "id": "feefd4f6-65e2-4db7-96f2-6ce30eda4449",
  "idempotency_key": "5f5d484e4362cd3660e33fbef3b16e5d52e133ad19500f7be5a3d90584864588",
  "in_reply_to": "cf66cc3e-859a-4789-bb63-30342690b504",
  "message_type": "result",
  "payload": {
    "output": {
      "attempts": 3,
      "backoff_delays_ms": [
        1156,
        2027
      ],
      "duration_ms": 4555,
      "exit_code": 1,
      "ok": false,
      "stderr_tail": "#< CLIXML\r\nerror: unknown option '--policy'\n<Objs Version=\"1.1.0.1\" xmlns=\"http://schemas.microsoft.com/powershell/2004/04\"><Obj S=\"progress\" RefId=\"0\"><TN RefId=\"0\"><T>System.Management.Automation.PSCustomObject</T><T>System.Object</T></TN><MS><I64 N=\"SourceId\">1</I64><PR N=\"Record\"><AV>����׼���״�ʹ��ģ�顣</AV><AI>0</AI><Nil /><PI>-1</PI><PC>-1</PC><T>Completed</T><SR>-1</SR><SD> </SD></PR></MS></Obj></Objs>",
      "stdout_tail": "",
      "transport": "claude_p_subprocess"
    }
  },
  "recipient": "codex",
  "retry_count": 0,
  "schema_version": "1.0",
  "sender": "claudecode",
  "timestamp": "2026-10-09T01:11:08Z",
  "ttl_ms": 600000
}