{
  "correlation_id": "ba8fcb71-c204-41f6-9cfd-0102157f204f",
  "id": "a4c19299-2d2c-454f-a4a1-b3bc9ff2f077",
  "idempotency_key": "53b180a2cfb51605cb66276194a0398be9c50a1dc7ba35bf7db07257a9e2ea04",
  "in_reply_to": "ba8fcb71-c204-41f6-9cfd-0102157f204f",
  "message_type": "result",
  "payload": {
    "output": {
      "attempts": 3,
      "backoff_delays_ms": [
        1082,
        2111
      ],
      "duration_ms": 10259,
      "exit_code": 1,
      "ok": false,
      "stderr_tail": "#< CLIXML\r\n<Objs Version=\"1.1.0.1\" xmlns=\"http://schemas.microsoft.com/powershell/2004/04\"><Obj S=\"progress\" RefId=\"0\"><TN RefId=\"0\"><T>System.Management.Automation.PSCustomObject</T><T>System.Object</T></TN><MS><I64 N=\"SourceId\">1</I64><PR N=\"Record\"><AV>����׼���״�ʹ��ģ�顣</AV><AI>0</AI><Nil /><PI>-1</PI><PC>-1</PC><T>Completed</T><SR>-1</SR><SD> </SD></PR></MS></Obj></Objs>",
      "stdout_tail": "Not logged in · Please run /login\n",
      "transport": "claude_p_subprocess"
    }
  },
  "recipient": "codex",
  "retry_count": 0,
  "schema_version": "1.0",
  "sender": "claudecode",
  "timestamp": "2026-10-09T01:10:54Z",
  "ttl_ms": 600000
}